{
  "name": "Riksdag & Regering MCP",
  "repository_url": "https://github.com/isakskogstad/Riksdag-Regering-MCP",
  "site_url": "https://github.com/isakskogstad/Riksdag-Regering-MCP/blob/32ceae410346fdb5ca215cdd94b2261038fce906/README.md",
  "author": "isakskogstad",
  "language": "TypeScript",
  "license": "MIT",
  "stars": 31,
  "category": "government-public-finance",
  "description": "Searches Swedish parliamentary documents, members, debates and votes, plus Government Offices material exposed through g0v.se.",
  "tags": [
    "sweden",
    "riksdagen",
    "regeringen",
    "parliament",
    "open-data"
  ],
  "transport": "stdio",
  "last_verified": "2026-09-14",
  "tools": [
    "search_ledamoter",
    "search_dokument",
    "search_dokument_fulltext",
    "search_anforanden",
    "search_voteringar",
    "search_regering",
    "get_g0v_document_types",
    "get_g0v_category_codes",
    "get_g0v_latest_update",
    "get_g0v_document_content",
    "analyze_g0v_by_department",
    "get_dokument",
    "get_ledamot",
    "get_motioner",
    "get_propositioner",
    "get_betankanden",
    "get_fragor",
    "get_interpellationer",
    "get_utskott",
    "get_regering_document",
    "summarize_regering_document",
    "get_dokument_innehall",
    "fetch_paginated_documents",
    "fetch_paginated_anforanden",
    "batch_fetch_documents",
    "get_calendar_events",
    "get_voting_group",
    "list_reports",
    "fetch_report",
    "enhanced_government_search",
    "get_sync_status",
    "get_data_dictionary"
  ],
  "quality": {
    "rubric_version": 1,
    "reviewed_at": "2026-09-14",
    "status": "unassessed",
    "reason": "Source and metadata review only; no full rubric assessment or local execution. Stdio registration is verified, but the custom optional HTTP transport was not established as standards-compatible. Government Offices material is accessed through third-party g0v.se.",
    "evidence": [
      "https://github.com/isakskogstad/Riksdag-Regering-MCP/blob/32ceae410346fdb5ca215cdd94b2261038fce906/README.md",
      "https://github.com/isakskogstad/Riksdag-Regering-MCP/blob/32ceae410346fdb5ca215cdd94b2261038fce906/mcp/src/core/mcpServer.ts",
      "https://github.com/isakskogstad/Riksdag-Regering-MCP/blob/32ceae410346fdb5ca215cdd94b2261038fce906/mcp/src/index.ts",
      "https://github.com/isakskogstad/Riksdag-Regering-MCP/blob/32ceae410346fdb5ca215cdd94b2261038fce906/mcp/LICENSE"
    ]
  }
}
